### ISSUE TITLE
Problem with passive for IPv6 clients to IPv4 backend

### ISSUE THREAD

**Issue by gsalisbury** [Castaglia/proftpd-mod_proxy_protocol#9]
Hi, I am using the proxy protocol for a proftpd server behind a F5 load-balancer. The F5 has an IPv4 and IPv6 address for the ftp service, and proxies to a proftpd server running only IPv4 on a RFC1918 address. This is working well for IPv4 client connections to the F5 using both passive and active transfers. IPv6 active transfers are working, however passive are not.

I expected this configuration to work the same as it does for IPv4 clients, is there something I'm missing?

Logs from running with -d 10 and -n flags:
```
2018-05-24 11:14:31,578 ftp-app01 proftpd[41541] 10.0.200.19 (2001:dd8:8:101:203:119:97:4[2001:dd8:8:101:203:119:97:4]): ANON ftp: Login successful.
2018-05-24 11:14:31,695 ftp-app01 proftpd[41541] 10.0.200.19 (2001:dd8:8:101:203:119:97:4[2001:dd8:8:101:203:119:97:4]): dispatching PRE_CMD command 'SYST' to mod_core
2018-05-24 11:14:31,696 ftp-app01 proftpd[41541] 10.0.200.19 (2001:dd8:8:101:203:119:97:4[2001:dd8:8:101:203:119:97:4]): dispatching PRE_CMD command 'SYST' to mod_core
2018-05-24 11:14:31,696 ftp-app01 proftpd[41541] 10.0.200.19 (2001:dd8:8:101:203:119:97:4[2001:dd8:8:101:203:119:97:4]): dispatching CMD command 'SYST' to mod_core
2018-05-24 11:14:31,696 ftp-app01 proftpd[41541] 10.0.200.19 (2001:dd8:8:101:203:119:97:4[2001:dd8:8:101:203:119:97:4]): dispatching LOG_CMD command 'SYST' to mod_log
2018-05-24 11:14:34,565 ftp-app01 proftpd[41541] 10.0.200.19 (2001:dd8:8:101:203:119:97:4[2001:dd8:8:101:203:119:97:4]): dispatching PRE_CMD command 'PORT 10,0,200,8,184,51' to mod_core
2018-05-24 11:14:34,565 ftp-app01 proftpd[41541] 10.0.200.19 (2001:dd8:8:101:203:119:97:4[2001:dd8:8:101:203:119:97:4]): dispatching PRE_CMD command 'PORT 10,0,200,8,184,51' to mod_core
2018-05-24 11:14:34,565 ftp-app01 proftpd[41541] 10.0.200.19 (2001:dd8:8:101:203:119:97:4[2001:dd8:8:101:203:119:97:4]): dispatching CMD command 'PORT 10,0,200,8,184,51' to mod_core
2018-05-24 11:14:34,565 ftp-app01 proftpd[41541] 10.0.200.19 (2001:dd8:8:101:203:119:97:4[2001:dd8:8:101:203:119:97:4]): in dir_check_full(): path = '/', fullpath = '/'
2018-05-24 11:14:34,566 ftp-app01 proftpd[41541] 10.0.200.19 (2001:dd8:8:101:203:119:97:4[2001:dd8:8:101:203:119:97:4]): dispatching LOG_CMD command 'PORT 10,0,200,8,184,51' to mod_log
2018-05-24 11:14:34,655 ftp-app01 proftpd[41541] 10.0.200.19 (2001:dd8:8:101:203:119:97:4[2001:dd8:8:101:203:119:97:4]): dispatching PRE_CMD command 'LIST' to mod_core
2018-05-24 11:14:34,655 ftp-app01 proftpd[41541] 10.0.200.19 (2001:dd8:8:101:203:119:97:4[2001:dd8:8:101:203:119:97:4]): dispatching PRE_CMD command 'LIST' to mod_core
2018-05-24 11:14:34,655 ftp-app01 proftpd[41541] 10.0.200.19 (2001:dd8:8:101:203:119:97:4[2001:dd8:8:101:203:119:97:4]): dispatching CMD command 'LIST' to mod_ls
2018-05-24 11:14:34,656 ftp-app01 proftpd[41541] 10.0.200.19 (2001:dd8:8:101:203:119:97:4[2001:dd8:8:101:203:119:97:4]): ROOT PRIVS at inet.c:409
2018-05-24 11:14:34,656 ftp-app01 proftpd[41541] 10.0.200.19 (2001:dd8:8:101:203:119:97:4[2001:dd8:8:101:203:119:97:4]): ROOT PRIVS: ID switching disabled
2018-05-24 11:14:34,656 ftp-app01 proftpd[41541] 10.0.200.19 (2001:dd8:8:101:203:119:97:4[2001:dd8:8:101:203:119:97:4]): RELINQUISH PRIVS at inet.c:483
2018-05-24 11:14:34,656 ftp-app01 proftpd[41541] 10.0.200.19 (2001:dd8:8:101:203:119:97:4[2001:dd8:8:101:203:119:97:4]): RELINQUISH PRIVS: ID switching disabled
2018-05-24 11:14:34,705 ftp-app01 proftpd[41541] 10.0.200.19 (2001:dd8:8:101:203:119:97:4[2001:dd8:8:101:203:119:97:4]): UseReverseDNS off, returning IP address instead of DNS name
2018-05-24 11:14:34,705 ftp-app01 proftpd[41541] 10.0.200.19 (2001:dd8:8:101:203:119:97:4[2001:dd8:8:101:203:119:97:4]): active data connection opened - local  : ::ffff:10.0.200.19:20
2018-05-24 11:14:34,705 ftp-app01 proftpd[41541] 10.0.200.19 (2001:dd8:8:101:203:119:97:4[2001:dd8:8:101:203:119:97:4]): active data connection opened - remote : 10.0.200.8:47155
2018-05-24 11:14:34,706 ftp-app01 proftpd[41541] 10.0.200.19 (2001:dd8:8:101:203:119:97:4[2001:dd8:8:101:203:119:97:4]): in dir_check_full(): path = '/', fullpath = '/'
2018-05-24 11:14:34,706 ftp-app01 proftpd[41541] 10.0.200.19 (2001:dd8:8:101:203:119:97:4[2001:dd8:8:101:203:119:97:4]): in dir_check_full(): path = '/pub', fullpath = '/pub'
2018-05-24 11:14:34,706 ftp-app01 proftpd[41541] 10.0.200.19 (2001:dd8:8:101:203:119:97:4[2001:dd8:8:101:203:119:97:4]): in dir_check_full(): path = '/public', fullpath = '/public'
2018-05-24 11:14:34,707 ftp-app01 proftpd[41541] 10.0.200.19 (2001:dd8:8:101:203:119:97:4[2001:dd8:8:101:203:119:97:4]): in dir_check_full(): path = '/welcome.msg', fullpath = '/welcome.msg'
2018-05-24 11:14:34,795 ftp-app01 proftpd[41541] 10.0.200.19 (2001:dd8:8:101:203:119:97:4[2001:dd8:8:101:203:119:97:4]): dispatching LOG_CMD command 'LIST' to mod_log
2018-05-24 11:14:34,795 ftp-app01 proftpd[41541] 10.0.200.19 (2001:dd8:8:101:203:119:97:4[2001:dd8:8:101:203:119:97:4]): dispatching LOG_CMD command 'LIST' to mod_ls
2018-05-24 11:14:37,633 ftp-app01 proftpd[41414] 10.0.200.19: scrubbing scoreboard
2018-05-24 11:14:37,633 ftp-app01 proftpd[41414] 10.0.200.19: ROOT PRIVS at scoreboard.c:1411
2018-05-24 11:14:37,633 ftp-app01 proftpd[41414] 10.0.200.19: RELINQUISH PRIVS at scoreboard.c:1414
2018-05-24 11:14:37,633 ftp-app01 proftpd[41414] 10.0.200.19: ROOT PRIVS at scoreboard.c:1455
2018-05-24 11:14:37,633 ftp-app01 proftpd[41414] 10.0.200.19: RELINQUISH PRIVS at scoreboard.c:1564
2018-05-24 11:14:37,633 ftp-app01 proftpd[41414] 10.0.200.19: finished scrubbing scoreboard
2018-05-24 11:14:44,355 ftp-app01 proftpd[41541] 10.0.200.19 (2001:dd8:8:101:203:119:97:4[2001:dd8:8:101:203:119:97:4]): dispatching PRE_CMD command 'PASV' to mod_core
2018-05-24 11:14:44,355 ftp-app01 proftpd[41541] 10.0.200.19 (2001:dd8:8:101:203:119:97:4[2001:dd8:8:101:203:119:97:4]): dispatching PRE_CMD command 'PASV' to mod_core
2018-05-24 11:14:44,355 ftp-app01 proftpd[41541] 10.0.200.19 (2001:dd8:8:101:203:119:97:4[2001:dd8:8:101:203:119:97:4]): dispatching CMD command 'PASV' to mod_core
2018-05-24 11:14:44,355 ftp-app01 proftpd[41541] 10.0.200.19 (2001:dd8:8:101:203:119:97:4[2001:dd8:8:101:203:119:97:4]): in dir_check_full(): path = '/', fullpath = '/'
2018-05-24 11:14:44,355 ftp-app01 proftpd[41541] 10.0.200.19 (2001:dd8:8:101:203:119:97:4[2001:dd8:8:101:203:119:97:4]): Unable to handle PASV for IPv6 address '::ffff:10.0.200.19', rejecting command
```

proftpd -vv output:
```
ProFTPD Version: 1.3.6 (stable)
  Scoreboard Version: 01040003
  Built: Thu May 24 2018 05:30:48 AEST

Loaded modules:
  mod_proxy_protocol/0.1
  mod_vroot/0.9.5
  mod_ctrls_admin/0.9.9
  mod_lang/1.1
  mod_ctrls/0.9.5
  mod_cap/1.1
  mod_ident/1.0
  mod_dso/0.5
  mod_facts/0.6
  mod_delay/0.7
  mod_site.c
  mod_log.c
  mod_ls.c
  mod_auth.c
  mod_auth_file/1.0
  mod_auth_unix.c
  mod_rlimit/1.0
  mod_xfer.c
  mod_core.c
```

I have no virtual hosts configured, relevant config snippets:
```
<IfModule mod_proxy_protocol.c>
  ProxyProtocolEngine           on
  ProxyProtocolTimeout          3sec
  ProxyProtocolVersion          haproxyV1
  AllowForeignAddress           on
</IfModule>
```

**Comment by Castaglia** [comment]
Interesting edge case.  Does the FTP client in question know that it is talking to the IPv6 address on the F5?  If so, it should _not_ be sending `PASV` to an IPv6 address.

**Comment by Castaglia** [comment]
On the other hand:
```
Unable to handle PASV for IPv6 address '::ffff:10.0.200.19', rejecting command
```
That `'::ffff:10.0.200.19` is the IPv6 address, reported by the F5, in its `PROXY` message, correct?  Perhaps I can address this by allowing `mod_proxy_protocol` to notice that is an IPv4-mapped IPv6 address, and either _automatically_ treat/set it as the corresponding IPv4 address, _or_ have a configuration option to enable that behavior.

**Comment by Castaglia** [comment]
Hmm.  Could you also provide the output from `proftpd -V`, please?  In particular, I'd like to see if your `proftpd` has IPv6 support enabled.  [This commit](https://github.com/Castaglia/proftpd-mod_proxy_protocol/commit/706886d982a4c0e8cbfabb39d7548270d64d2d91) _should_ be handling your IPv4-mapped IPv6 address, from the F5 properly.

Perhaps I simply need to do a release of the current master branch, as version `0.2` of this module, and see if the newer code works as you need?

**Comment by gsalisbury** [comment]
proftpd -V:
```
Compile-time Settings:
  Version: 1.3.6 (stable)
  Platform: LINUX [Linux 3.10.0-862.3.2.el7.x86_64 x86_64]
  Built: Thu May 24 2018 05:30:48 AEST
  Built With:
    configure  '--build=x86_64-redhat-linux-gnu' '--host=x86_64-redhat-linux-gnu' '--program-prefix=' '--disable-dependency-tracking' '--prefix=/usr' '--exec-prefix=/usr' '--bindir=/usr/bin' '--sbindir=/usr/sbin' '--sysconfdir=/etc' '--datadir=/usr/share' '--includedir=/usr/include' '--libdir=/usr/lib64' '--libexecdir=/usr/libexec' '--localstatedir=/var' '--sharedstatedir=/var/lib' '--mandir=/usr/share/man' '--infodir=/usr/share/info' '--libexecdir=/usr/libexec/proftpd' '--localstatedir=/run/proftpd' '--disable-strip' '--enable-ctrls' '--enable-dso' '--enable-facl' '--enable-ipv6' '--enable-nls' '--enable-openssl' '--enable-shadow' '--with-lastlog' '--with-libraries=/usr/lib64/mysql' '--with-includes=/usr/include/mysql' '--with-pkgconfig=lib64/pkgconfig' '--with-shared=mod_auth_pam:mod_ban:mod_ctrls_admin:mod_deflate:mod_dnsbl:mod_dynmasq:mod_exec:mod_facl:mod_load:mod_quotatab:mod_quotatab_file:mod_quotatab_radius:mod_quotatab_sql:mod_radius:mod_ratio:mod_readme:mod_rewrite:mod_shaper:mod_site_misc:mod_snmp:mod_sql:mod_wrap2:mod_wrap2_file:mod_wrap2_redis:mod_wrap2_sql:mod_unique_id:mod_auth_otp:mod_digest:mod_sftp:mod_sftp_pam:mod_sftp_sql:mod_sql_passwd:mod_tls:mod_tls_fscache:mod_tls_shmcache:mod_ifsession:mod_proxy:mod_proxy_protocol:mod_vroot' 'build_alias=x86_64-redhat-linux-gnu' 'host_alias=x86_64-redhat-linux-gnu'

  CFLAGS: -g2 -O2 -Wall -fno-omit-frame-pointer -Werror=implicit-function-declaration
  LDFLAGS: -L$(top_srcdir)/lib  -rdynamic -L/usr/lib64/mysql
  LIBS: -lacl  -lssl -lcrypto -lcap -lsupp -lattr -lnsl -lresolv -lresolv -lcrypt -ldl 

  Files:
    Configuration File:
      /etc/proftpd.conf
    Pid File:
      /run/proftpd/proftpd.pid
    Scoreboard File:
      /run/proftpd/proftpd.scoreboard
    Header Directory:
      /usr/include/proftpd
    Shared Module Directory:
      /usr/libexec/proftpd

  Info:
    + Max supported UID: 4294967295
    + Max supported GID: 4294967295

  Features:
    - Autoshadow support
    + Controls support
    + curses support
    - Developer support
    + DSO support
    + IPv6 support
    + Largefile support
    + Lastlog support
    - Memcache support
    + ncursesw support
    + NLS support
    - Redis support
    - Sodium support
    + OpenSSL support (FIPS enabled)
    - PCRE support
    + POSIX ACL support
    + Shadow file support
    + Sendfile support
    + Trace support
    + xattr support

  Tunable Options:
    PR_TUNABLE_BUFFER_SIZE = 1024
    PR_TUNABLE_DEFAULT_RCVBUFSZ = 8192
    PR_TUNABLE_DEFAULT_SNDBUFSZ = 8192
    PR_TUNABLE_ENV_MAX = 2048
    PR_TUNABLE_GLOBBING_MAX_MATCHES = 100000
    PR_TUNABLE_GLOBBING_MAX_RECURSION = 8
    PR_TUNABLE_HASH_TABLE_SIZE = 40
    PR_TUNABLE_LOGIN_MAX = 256
    PR_TUNABLE_NEW_POOL_SIZE = 512
    PR_TUNABLE_PATH_MAX = 4096
    PR_TUNABLE_SCOREBOARD_BUFFER_SIZE = 80
    PR_TUNABLE_SCOREBOARD_SCRUB_TIMER = 30
    PR_TUNABLE_SELECT_TIMEOUT = 30
    PR_TUNABLE_TIMEOUTIDENT = 10
    PR_TUNABLE_TIMEOUTIDLE = 600
    PR_TUNABLE_TIMEOUTLINGER = 10
    PR_TUNABLE_TIMEOUTLOGIN = 300
    PR_TUNABLE_TIMEOUTNOXFER = 300
    PR_TUNABLE_TIMEOUTSTALLED = 3600
    PR_TUNABLE_XFER_SCOREBOARD_UPDATES = 10
```

**Comment by gsalisbury** [comment]
A tcpdump on the server of a connection from the F5 shows PROXY as:
```
PROXY TCP6 2001:dc0:2001:210:250:b6ff:feda:eef2 2001:dd8:9:2::101:24 47814 21
```

The F5 irule I am using for this is:
```
when CLIENT_ACCEPTED {
    if { ([TCP::local_port] != 80 and [TCP::local_port] != 443)} {
        set proxyheader "PROXY TCP[IP::version] [IP::remote_addr] [IP::local_addr] [TCP::remote_port] [TCP::local_port]\r\n"
    }
}
 
when SERVER_CONNECTED {
    if { [info exists proxyheader] } {
        TCP::respond $proxyheader
    }
}
```

The backend server will also host a HTTP service for a HTTP view of the same files and I don't need to use the PROXY protocol for these requests as I will be inserting an X-Forwarded-For HTTP header to log client IPs.

**Comment by gsalisbury** [comment]
Some more tcpdumps below from running a `ls` command after changing mode to passive in my ftp client (`ftp (GNU inetutils) 1.9.4`).

Tcpdump on FTP server (`tcpdump -n -i ens160 port 21`):
```
 10:31:31.513725 IP 10.0.200.8.48484 > 10.0.200.19.ftp: Flags [P.], seq 132:138, ack 1054, win 5433, options [nop,nop,TS val 2754101675 ecr 359600161], length 6: FTP: PASV
10:31:31.514467 IP 10.0.200.19.ftp > 10.0.200.8.48484: Flags [P.], seq 1054:1089, ack 138, win 28960, options [nop,nop,TS val 359611458 ecr 2754101675], length 35: FTP: 501 PASV: Operation not permitted
10:31:31.514633 IP 10.0.200.8.48484 > 10.0.200.19.ftp: Flags [.], ack 1089, win 5468, options [nop,nop,TS val 2754101676 ecr 359611458], length 0
10:31:31.515566 IP 10.0.200.8.48484 > 10.0.200.19.ftp: Flags [P.], seq 138:144, ack 1089, win 5468, options [nop,nop,TS val 2754101677 ecr 359611458], length 6: FTP: LPSV
10:31:31.515809 IP 10.0.200.19.ftp > 10.0.200.8.48484: Flags [P.], seq 1089:1114, ack 144, win 28960, options [nop,nop,TS val 359611459 ecr 2754101677], length 25: FTP: 500 LPSV not understood
10:31:31.516007 IP 10.0.200.8.48484 > 10.0.200.19.ftp: Flags [.], ack 1114, win 5493, options [nop,nop,TS val 2754101677 ecr 359611459], length 0
```

Tcpdump on F5 (`tcpdump -n -i any port 21`):
```
10:31:31.514506 IP6 2001:dc0:2001:210:250:b6ff:feda:eef2.48484 > 2001:dd8:9:2::101:24.ftp: Flags [P.], seq 83:89, ack 1054, win 29480, options [nop,nop,TS val 4114616869 ecr 2754090376], length 6: FTP: EPSV in slot1/tmm3 lis=/Public/ftp2.apnic.net-v6
10:31:31.514517 IP 10.0.200.8.48484 > 10.0.200.19.ftp: Flags [P.], seq 132:138, ack 1054, win 5433, options [nop,nop,TS val 2754101675 ecr 359600161], length 6: FTP: PASV out slot1/tmm3 lis=/Public/ftp2.apnic.net-v6
10:31:31.514519 IP6 2001:dd8:9:2::101:24.ftp > 2001:dc0:2001:210:250:b6ff:feda:eef2.48484: Flags [.], ack 89, win 4228, options [nop,nop,TS val 2754101675 ecr 4114616869], length 0 out slot1/tmm3 lis=/Public/ftp2.apnic.net-v6
10:31:31.515440 IP 10.0.200.19.ftp > 10.0.200.8.48484: Flags [P.], seq 1054:1089, ack 138, win 28960, options [nop,nop,TS val 359611458 ecr 2754101675], length 35: FTP: 501 PASV: Operation not permitted in slot1/tmm3 lis=/Public/ftp2.apnic.net-v6
10:31:31.515449 IP6 2001:dd8:9:2::101:24.ftp > 2001:dc0:2001:210:250:b6ff:feda:eef2.48484: Flags [P.], seq 1054:1089, ack 89, win 4228, options [nop,nop,TS val 2754101676 ecr 4114616869], length 35: FTP: 501 PASV: Operation not permitted out slot1/tmm3 lis=/Public/ftp2.apnic.net-v6
10:31:31.515453 IP 10.0.200.8.48484 > 10.0.200.19.ftp: Flags [.], ack 1089, win 5468, options [nop,nop,TS val 2754101676 ecr 359611458], length 0 out slot1/tmm3 lis=/Public/ftp2.apnic.net-v6
10:31:31.516343 IP6 2001:dc0:2001:210:250:b6ff:feda:eef2.48484 > 2001:dd8:9:2::101:24.ftp: Flags [P.], seq 89:95, ack 1089, win 29480, options [nop,nop,TS val 4114616871 ecr 2754101676], length 6: FTP: LPSV in slot1/tmm3 lis=/Public/ftp2.apnic.net-v6
10:31:31.516352 IP 10.0.200.8.48484 > 10.0.200.19.ftp: Flags [P.], seq 138:144, ack 1089, win 5468, options [nop,nop,TS val 2754101677 ecr 359611458], length 6: FTP: LPSV out slot1/tmm3 lis=/Public/ftp2.apnic.net-v6
10:31:31.516355 IP6 2001:dd8:9:2::101:24.ftp > 2001:dc0:2001:210:250:b6ff:feda:eef2.48484: Flags [.], ack 95, win 4234, options [nop,nop,TS val 2754101677 ecr 4114616871], length 0 out slot1/tmm3 lis=/Public/ftp2.apnic.net-v6
10:31:31.516767 IP 10.0.200.19.ftp > 10.0.200.8.48484: Flags [P.], seq 1089:1114, ack 144, win 28960, options [nop,nop,TS val 359611459 ecr 2754101677], length 25: FTP: 500 LPSV not understood in slot1/tmm3 lis=/Public/ftp2.apnic.net-v6
10:31:31.516774 IP6 2001:dd8:9:2::101:24.ftp > 2001:dc0:2001:210:250:b6ff:feda:eef2.48484: Flags [P.], seq 1089:1114, ack 95, win 4234, options [nop,nop,TS val 2754101677 ecr 4114616871], length 25: FTP: 500 LPSV not understood out slot1/tmm3 lis=/Public/ftp2.apnic.net-v6
10:31:31.516777 IP 10.0.200.8.48484 > 10.0.200.19.ftp: Flags [.], ack 1114, win 5493, options [nop,nop,TS val 2754101677 ecr 359611459], length 0 out slot1/tmm3 lis=/Public/ftp2.apnic.net-v6
10:31:31.558233 IP6 2001:dc0:2001:210:250:b6ff:feda:eef2.48484 > 2001:dd8:9:2::101:24.ftp: Flags [.], ack 1114, win 29480, options [nop,nop,TS val 4114616913 ecr 2754101677], length 0 in slot1/tmm3 lis=/Public/ftp2.apnic.net-v6
```

**Comment by Castaglia** [comment]
Which FTP client are you using?  I ask because FTP clients should not be sending `PASV` if they connect to an IPv6 address; `PASV` (and `PORT`) only support IPv4 addresses.

**Comment by gsalisbury** [comment]
I'm using ftp (GNU inetutils) 1.9.4 as the client from a linux host.

My client is correctly sending the EPSV command, according to tcpdump, and the F5 is converting this to a PASV command when it proxies to proftpd:

```
10:31:31.514506 IP6 2001:dc0:2001:210:250:b6ff:feda:eef2.48484 > 2001:dd8:9:2::101:24.ftp: Flags [P.], seq 83:89, ack 1054, win 29480, options [nop,nop,TS val 4114616869 ecr 2754090376], length 6: FTP: EPSV in slot1/tmm3 lis=/Public/ftp2.apnic.net-v6
10:31:31.514517 IP 10.0.200.8.48484 > 10.0.200.19.ftp: Flags [P.], seq 132:138, ack 1054, win 5433, options [nop,nop,TS val 2754101675 ecr 359600161], length 6: FTP: PASV out slot1/tmm3 lis=/Public/ftp2.apnic.net-v6
```

The problem appears to me to be proftpd on receipt of the PASV  responds with `501 PASV: Operation not permitted` I believe because with mod_proxy_protocol it sees the client as being an IPv6 client.

I could perhaps try and get the F5 to _not_ transform the EPSV command to PASV which may work.

**Comment by gsalisbury** [comment]
[RFC6384](https://tools.ietf.org/html/rfc6384) suggests this is acceptable and recommended in some cases.

**Comment by Castaglia** [comment]
Yes -- but only if the ALG (the F5, in this case) can properly reformat the `PASV` 227 response message to the appropriate `EPSV` 229 response message.  _Can_ the F5 do that?  I can provide a patch, for the core ProFTPD distribution, to make this "reject PASV commands if not IPv4" before configurable, if you'd be able to test it.

**Comment by gsalisbury** [comment]
I believe the F5 can as it works fine without mod_proxy_protocol enabled.

Being able to disable rejecting PASV commands if not IPv4 would be helpful and happy to test the patch.

**Comment by Castaglia** [comment]
Can you see if [this PR](https://github.com/proftpd/proftpd/pull/722) makes your use case work?

**Comment by gsalisbury** [comment]
Hi @Castaglia, this patch makes my use case work :+1:

**Comment by Castaglia** [comment]
Excellent.  I've now merged that PR, and thus consider this ticket fixed.  Please re-open if you feel differently.
